A股,000698,2023-08-07,科创100,成长,,10.51%,-40.42%,-46.09%,2.1e+02,38.05%,6.3,100.00%,3.00%,0.30%,"科创100(588190), 国泰上证科创板100ETF(588120), 科创100ETF基金(588220), 博时科创100ETF(588030), 鹏华上证科创100ETF联接A(019861), 银华上证科创板100ETF联接A(019859), 易方达上证科创板100ETF(588210), 国泰上证科创板100ETF发起联接A(019866), 博时上证科创板100ETF联接A(019857), 博时上证科创板100ETF联接C(019858), 科创指数(588880), 华夏上证科创板100ETF(588800), 南方上证科创板100ETF(588900), 国泰上证科创板100ETF发起联接C(019867), 华夏科创100ETF联接A(020291), 鹏华上证科创100ETF联接C(019862), 银华上证科创板100ETF联接C(019860), 华泰柏瑞上证科创板100ETF发起式联接A(020320), 华夏上证科创板100ETF联接C(020292), 华泰柏瑞上证科创板100ETF发起式联接C(020321), 天弘上证科创板100指数增强发起A(021385), 永赢上证科创板100指数增强发起A(021278), 南方上证科创板100ETF联接A(020683), 天弘上证科创板100指数增强发起C(021386), 永赢上证科创板100指数增强发起C(021279), 易方达上证科创板100增强策略ETF(588500), 广发上证科创板100增强策略ETF(588680), 中欧上证科创板100指数发起A(021660), 南方上证科创板100ETF联接C(020684), 易方达上证科创板100ETF联接发起式A(020293), 中欧上证科创板100指数发起C(021661), 易方达上证科创板100ETF联接发起式C(020294), 浦银安盛科创板100指数增强A(021284), 万家上证科创板100指数增强发起式A(021275), 富国上证科创板100指数发起式A(021329), 万家上证科创板100指数增强发起式C(021276), 浦银安盛科创板100指数增强C(021285), 富国上证科创板100指数发起式C(021330), 交银上证科创板100指数A(023050), 汇添富上证科创板100ETF联接A(023001), 交银上证科创板100指数C(023051), 长城上证科创板100指数增强A(023446), 汇添富上证科创板100ETF联接C(023002), 汇添富上证科创板100ETF(589980), 广发上证科创板100ETF(588980), 长城上证科创板100指数增强C(023447), 华商上证科创板100指数增强(023323)"
A股,000699,2024-08-20,科创200,,,9.24%,-17.51%,-24.49%,3.3e+02,93.41%,4.8,100.00%,1.45%,0.40%,"科创200(588230), 华夏上证科创板200ETF(588820), 鹏华科创板200ETF(588240), 华泰柏瑞上证科创板200ETF发起式联接A(023382), 国投瑞银上证科创板200指数发起式A(023518), 华泰柏瑞上证科创板200ETF发起式联接C(023383), 华泰柏瑞上证科创板200ETF发起式联接I(023388), 国投瑞银上证科创板200指数发起式C(023519), 鹏华上证科创板200ETF联接A(023926), 易方达上证科创板200ETF(588270), 鹏华上证科创板200ETF联接C(023927), 景顺长城上证科创板200指数(023111), 华夏上证科创板200ETF联接A(023621), 科创200ETF工银(589200), 建信上证科创板200ETF(589820), 建信上证科创板 200ETF 联接(023686), 广发上证科创板200指数(023748), 易方达上证科创板200ETF联接(024978), 华夏上证科创板200ETF联接C(023622)"
A股,000806,2012-02-10,消费服务,成长,,-41.78%,-58.04%,-27.93%,1.1e+01,62.60%,1.2,27.97%,10.91%,3.35%,消费服务ETF(516600)
A股,000807,2012-02-17,食品饮料,成长,,-55.34%,-61.25%,-13.23%,2e+01,7.00%,4.6,12.15%,23.00%,3.84%,华安中证申万食品饮料ETF(516900)
A股,000808,2012-02-17,医药生物,成长,,-52.16%,-63.07%,-22.81%,3.7e+01,68.04%,3.4,21.25%,9.19%,1.35%,"申万菱信中证申万医药生物指数A(163118), 申万菱信中证申万医药生物指数C(015176)"
A股,000811,2012-04-11,细分有色,周期,,24.52%,-61.83%,-69.35%,2.8e+01,43.29%,3.8,99.22%,13.57%,1.25%,"华夏中证细分有色金属产业主题ETF(516650), 华夏有色金属ETF联接A(016707), 华夏中证细分有色金属产业主题ETF发起式联接C(016708), 汇添富中证细分有色金属产业主题ETF(159652), 汇添富中证细分有色金属产业主题ETF发起式联接A(019164), 汇添富中证细分有色金属产业主题ETF发起式联接C(019165), 华夏中证细分有色金属产业主题ETF发起式联接D(021534)"
A股,000812,2012-04-11,细分机械,成长,,-29.58%,-70.43%,-58.01%,4e+01,77.18%,3.1,75.37%,7.75%,1.47%,"富国中证细分机械设备产业主题ETF(159886), 国泰中证细分机械设备产业主题ETF(516960), 富国中证细分机械设备产业主题ETF发起式联接A(021327), 富国中证细分机械设备产业主题ETF发起式联接C(021328)"
A股,000813,2012-04-11,细分化工,成长,,-34.48%,-62.43%,-42.66%,3e+01,82.54%,2.8,57.58%,9.33%,1.34%,"富国中证细分化工产业主题ETF(516120), 国泰中证细分化工产业主题ETF(516220), 华宝化工ETF(516020), 化工ETF(159870), 华宝化工ETF联接A(012537), 华宝化工ETF联接C(012538), 鹏华中证细分化工产业主题ETF联接A(014942), 鹏华中证细分化工产业主题ETF联接C(014943), 天弘中证细分化工指数发起A(015896), 天弘中证细分化工指数发起C(015897), 嘉实中证细分化工产业主题指数发起式A(013527), 嘉实中证细分化工产业主题指数发起式C(013528), 富国中证细分化工产业主题ETF发起式联接A(020273), 富国中证细分化工产业主题ETF发起式联接C(020274), 东财中证化工指数发起式A(019589), 东财中证化工指数发起式C(019590), 中欧中证细分化工产业主题指数发起A(021977), 中欧中证细分化工产业主题指数发起C(021978)"
A股,000814,2012-04-11,细分医药,成长,,-49.54%,-62.43%,-25.54%,3.7e+01,76.19%,3.5,27.97%,9.46%,1.26%,"华安中证细分医药ETF联接C(000376), 华安中证细分医药ETF联接A(000373), 华安中证细分医药ETF(512120)"
A股,000815,2012-04-11,细分食品,成长,,-53.31%,-59.65%,-13.58%,2e+01,6.92%,4.5,10.63%,22.50%,3.78%,"华宝中证细分食品饮料产业主题ETF(515710), 华夏中证细分食品饮料产业主题ETF(515170), 华宝食品ETF联接A(012548), 食品ETF(159862), 华宝食品ETF联接C(012549), 华夏食品饮料ETF联接A(013125), 华夏中证细分食品饮料产业主题ETF发起式联接C(013126), 华夏中证细分食品饮料产业主题ETF发起式联接D(024643)"
A股,000819,2012-05-09,有色金属,周期,,17.22%,-60.61%,-66.40%,2.8e+01,46.42%,4.0,98.97%,14.29%,1.24%,"南方中证申万有色金属ETF发起联接A(004432), 南方中证申万有色金属ETF发起联接C(004433), 南方中证申万有色金属ETF(512400), 南方中证申万有色金属ETF发起联接E(010990)"
A股,000821,2012-07-20,300红利,价值,,-3.55%,-40.47%,-38.28%,8.7,86.45%,0.88,49.42%,10.11%,4.56%,"建信沪深300红利ETF(512530), 建信沪深300红利ETF发起式联接A(012712), 建信沪深300红利ETF发起式联接C(012713)"
A股,000824,2012-07-20,国企红利,价值,,-2.08%,-44.51%,-43.33%,8.7,89.00%,0.87,55.81%,10.00%,4.65%,"西部利得国企红利指数增强A（场内简称：国企红利LOF）(501059), 西部利得国企红利指数增强C(009439), 鹏扬中证国有企业红利ETF(159515), 华安中证国有企业红利ETF(561060), 华安中证国有企业红利ETF发起式联接A(020461), 鹏扬中证国有企业红利ETF联接A(020115), 华安中证国有企业红利ETF发起式联接C(020462), 鹏扬中证国有企业红利ETF联接C(020116)"
A股,000825,2012-07-20,央企红利,价值,,-1.22%,-46.82%,-46.16%,9.2,96.71%,0.91,60.83%,9.89%,4.44%,"央企红利(561580), 华泰柏瑞中证中央企业红利ETF发起式联接A(020466), 华泰柏瑞中证中央企业红利ETF发起式联接C(020467), 富国中证中央企业红利ETF(159332), 富国中证中央企业红利ETF发起式联接A(021243), 富国中证中央企业红利ETF发起式联接C(021244)"
A股,000827,2012-09-25,中证环保,成长,,-36.73%,-69.02%,-51.04%,3.8e+01,89.13%,2.8,49.71%,7.37%,1.50%,"广发中证环保ETF联接A(001064), 广发中证环保ETF联接C(002984), 鹏华中证环保产业指数（LOF）A(160634), 申万菱信中证环保产业指数(LOF)A(163114), 新华中证环保产业指数(164304), 广发中证环保ETF(512580), 申万菱信中证环保产业指数(LOF)C(010419), 鹏华中证环保产业指数(LOF)C(015685)"
A股,000841,2012-12-21,800医药,成长,,-46.32%,-60.54%,-26.49%,3.8e+01,80.23%,3.5,32.17%,9.21%,1.30%,"中信保诚中证800医药指数（LOF）A(165519), 中信保诚中证800医药指数（LOF）C(013080), 中信保诚中证800医药指数（LOF）E(023592)"
A股,000852,2014-10-17,中证1000,宽基,,-26.85%,-72.35%,-62.20%,4.8e+01,79.53%,2.6,58.48%,5.42%,1.06%,"广发中证1000ETF联接C(006487), 创金合信中证1000增强A(003646), 创金合信中证1000增强C(003647), 招商中证1000指数增强C(004195), 招商中证1000指数增强A(004194), 富国中证1000指数增强（LOF）A(161039), 广发中证1000ETF联接A(006486), 南方中证1000ETF(512100), 万家中证1000指数增强A(005313), 万家中证1000指数增强C(005314), 建信中证1000指数增强C(006166), 建信中证1000指数增强A(006165), 华夏中证1000ETF(159845), 中证1000(516300), 南方中证1000ETF发起联接A(011860), 富国中证1000指数增强（LOF）C(013331), 建信中证1000指数增强发起E(013442), 南方中证1000ETF发起联接C(011861), 华夏中证1000指数增强A(014125), 天弘中证1000指数增强A(014201), 华夏中证1000ETF发起式联接A(013922), 华夏中证1000指数增强C(014126), 兴银中证1000指数增强A(014831), 天弘中证1000指数增强C(014202), 兴银中证1000指数增强C(014832), 华夏中证1000ETF发起式联接C(013923), 太平中证1000指数增强A(015466), 景顺长城中证1000指数增强A(015495), 中信建投中证1000指数增强A(015784), 景顺长城中证1000指数增强C(015496), 太平中证1000指数增强C(015467), 华安中证1000指数增强A(015148), 易方达中证1000ETF(159633), 广发中证1000ETF(560010), 富国中证1000ETF(159629), 国泰君安中证1000指数增强A(015867), 汇添富中证1000ETF(560110), 华安中证1000指数增强C(015149), 中信建投中证1000指数增强C(015785), 国泰君安中证1000指数增强C(015868), 南方中证1000ETF发起联接E(016643), 嘉实中证1000指数增强发起式A(016776), 1000增强ETF(159677), 鹏华中证1000指数增强A(016785), 国联安中证1000指数增强A(016962), 招商中证1000增强策略ETF(159680), 鑫元中证1000指数增强发起式A(017190), 1000增强(561590), 申万菱信中证1000指数增强A(017067), 嘉实中证1000指数增强发起式C(016777), 鑫元中证1000指数增强发起式C(017191), 国联安中证 1000 指数增强C(016963), 易方达中证1000ETF联接A(016630), 富国中证1000ETF联接A(016633), 鹏华中证1000指数增强C(016786), 富国中证1000ETF联接C(016634), 国泰中证1000增强策略ETF(159679), 易方达中证1000ETF联接C(016631), 天弘中证1000增强策略ETF(159685), 中金中证1000指数增强发起A(017733), 国金中证1000指数增强A(017846), 国金中证1000指数增强C(017847), 工银中证1000指数增强A(016942), 中欧中证1000指数增强A(017919), 博时中证1000指数增强A(016936), 申万菱信中证1000指数增强C(017068), 西部利得中证1000指数增强A(018157), 汇添富中证1000指数增强A(017953), 明亚中证1000指数增强A(017505), 易方达中证1000量化增强A(017094), 长信中证1000指数增强A(018013), 中金中证1000指数增强发起C(017734), 中欧中证1000指数增强C(017920), 华泰紫金中证1000指数增强发起A(018062), 汇添富中证1000ETF联接A(017161), 农银中证1000指数增强A(017323), 工银中证1000指数增强C(016943), 长信中证1000指数增强C(018014), 博时中证1000指数增强C(016937), 博道中证1000指数增强A(017644), 西部利得中证1000指数增强C(018158), 汇添富中证1000指数增强C(017954), 易方达中证1000量化增强C(017095), 明亚中证1000指数增强C(017506), 华泰紫金中证1000指数增强发起C(018063), 大成中证1000指数增强发起式A(018661), 1000ETF增强(560590), 汇添富中证1000ETF联接C(017162), 农银中证1000指数增强C(017324), 中证1000ETF增强(561280), 华泰柏瑞中证1000指数增强A(019240), 浙商中证1000指数增强A(018233), 大成中证1000指数增强发起式C(018662), 博道中证1000指数增强C(017645), 财通中证1000指数增强A(019270), 泰康中证1000指数增强发起A(019185), 博时中证1000增强ETF(561780), 华泰柏瑞中证1000指数增强C(019241), 浙商中证1000指数增强C(018234), 泰康中证1000指数增强发起C(019186), 中银中证1000指数增强A(019555), 财通中证1000指数增强C(019271), 中银中证1000指数增强C(019556), 财通资管中证1000指数增强A(019402), 财通资管中证1000指数增强C(019403), 中银中证1000指数增强E(022685), 中金中证1000指数增强发起B(024091)"
A股,000858,2013-11-06,500信息,成长,,5.55%,-69.05%,-70.68%,1e+02,94.52%,5.3,99.63%,5.30%,0.34%,南方中证500信息ETF发起联接C(004347)
A股,000860,2018-03-26,结构调整,价值,,-2.96%,-26.49%,-24.25%,1.5e+01,63.60%,1.4,76.88%,9.33%,3.69%,"博时央调ETF联接C(006439), 华夏中证央企ETF联接A(006196), 华夏中证央企ETF联接C(006197), 央企ETF(159959), 华夏中证央企ETF(512950), 博时央企结构调整ETF(512960), 博时央调ETF联接A(006438)"
A股,000901,2010-04-02,小康指数,价值,,1.79%,-52.68%,-53.51%,1.1e+01,51.94%,1.1,19.03%,10.00%,3.37%,"南方中证小康产业ETF联接C(004346), 南方小康ETF(510160), 南方中证小康产业ETF联接A(202021)"
A股,000903,2006-05-29,中证A100,宽基,,-22.74%,-50.06%,-35.36%,1.8e+01,99.96%,1.9,99.55%,10.56%,2.77%,"大成中证A100ETF(159923), 海富通中证A100指数A(162307), 国联安中证A100指数（LOF）(162509), 中银中证A100指数增强(163808), 国富中证A100指数增强（LOF）(164508), 宝盈中证A100指数增强A(213010), 华宝中证A100ETF联接A(240014), 诺安中证A100指数A(320010), 华富中证A100ETF联接A(410008), 长盛中证A100指数(519100), 南方中证A100ETF联接C(005691), 南方中证A100ETF联接A(202211), 广发中证A100ETF(512910), 华宝中证A100ETF联接C(007405), 广发中证A100ETF联接A(007135), 广发中证A100ETF联接C(007136), 宝盈中证A100指数增强C(007580), 海富通中证A100指数C(010224), 诺安中证A100指数C(010351), 华宝中证A100ETF(562000), 招商中证A100ETF(159631), 富国中证A100ETF(561180), 华夏中证A100ETF(159627), 汇添富中证A100ETF(159630), 华夏中证A100ETF发起式联接A(017862), 易方达中证A100ETF(159686), 华夏中证A100ETF发起式联接C(017863), 中证A100ETF工银(561200), 嘉实中证A100ETF(159661), 易方达中证A100ETF联接发起式A(020100), 易方达中证A100ETF联接发起式C(020101), 富国中证A100ETF发起式联接A(021245), 富国中证A100ETF发起式联接C(021246), 嘉实中证A100ETF发起联接A(020766), 招商中证A100ETF发起式联接A(021828), 嘉实中证A100ETF发起联接C(020767), 南方中证A100ETF(560380), 招商中证A100ETF发起式联接C(021829), 博时中证A100ETF联接A(022627), 华富中证A100ETF联接C(022661), 嘉实中证A100指数增强发起式A(021799), 华宝中证A100ETF联接Y(022926), 华富中证A100ETF(561880), 博时中证A100ETF联接C(022628), 嘉实中证A100指数增强发起式C(021800), 博时中证A100ETF(561770), 天弘中证A100ETF(512060), 鑫元中证A100指数A(023630), 鑫元中证A100指数C(023631)"
A股,000904,2007-01-15,中证200,宽基,,-3.23%,-61.89%,-60.62%,2.2e+01,95.10%,2.0,70.92%,9.09%,2.23%,泰信中证200指数(290010)
A股,000905,2007-01-15,中证500,宽基,,-0.60%,-65.20%,-64.99%,3.6e+01,86.90%,2.4,79.12%,6.67%,1.35%,"农银中证500指数(660011), 天弘中证500指数增强A(001556), 南方中证500量化增强股票发起C(002907), 中金中证500指数增强C(003578), 安信中证500指数增强A(005965), 招商中证500指数增强C(004193), 海富通中证500增强A(519034), 华宝中证500增强A(005607), 华宝中证500增强C(005608), 宏利500指数增强(LOF)(162216), 建信中证500指数增强C(005633), 国投瑞银中证500指数量化增强A(005994), 博时中证500指数增强C(005795), 天弘中证500ETF联接C(005919), 华泰柏瑞中证500ETF联接C(006087), 平安500ETF联接A(006214), 平安500ETF联接C(006215), 长城中证500指数增强A(006048), 易方达中证500ETF(510580), 汇添富中证500指数(LOF)A(501036), 广发中证500ETF联接C(002903), 招商中证500指数增强A(004192), 博时中证500指数增强A(005062), 汇添富中证500指数增强A(001050), 天弘中证500指数增强C(001557), 嘉实中证500ETF联接A(000008), 工银中证500ETF联接A(164809), 诺安中证500增强A(001351), 创金合信中证500增强A(002311), 创金合信中证500增强C(002316), 中金中证500指数增强A(003016), 申万菱信中证500指数增强A(002510), 南方中证500ETF联接（LOF）C(004348), 天弘中证500ETF联接A(000962), 南方中证500ETF联接（LOF）A(160119), 中邮中证500指数增强A(590007), 汇添富中证500指数（LOF）C(501037), 西部利得中证500指数增强A(502000), 平安中证500ETF(510590), 嘉实中证500ETF联接C(070039), 华夏中证500ETF联接C(006382), 建信中证500指数增强A(000478), 华夏中证500ETF联接A(001052), 华泰柏瑞中证500ETF联接A(001214), 国寿安保中证500ETF联接(001241), 景顺长城中证500ETF联接(001455), 申万菱信中证500指数优选增强A(003986), 长信中证500指数A(004945), 景顺长城中证500ETF(159935), 鹏华中证500指数（LOF）A(160616), 中信保诚中证500指数（LOF）A(165511), 南方中证500ETF(510500), 国寿安保中证500ETF(510560), 华夏中证500ETF(512500), 华泰柏瑞中证500ETF(512510), 南方中证500量化增强股票发起A(002906), 富国中证500指数增强（LOF）A/B(161017), 嘉实中证500ETF(159922), 广发中证500ETF(510510), 广发中证500ETF联接（LOF）A(162711), 国泰中证500指数增强A(003760), 国泰中证500指数增强C(003761), 浙商中证500增强A(002076), 国投瑞银中证500指数量化增强C(007089), 易方达中证500ETF联接A(007028), 易方达中证500ETF联接发起式C(007029), 景顺长城中证500指数增强A(006682), 长城中证500指数增强C(007413), 万家中证500指数增强发起式A(006729), 万家中证500指数增强发起式C(006730), 安信中证500指数增强C(005966), 人保中证500A(006611), 博道中证500增强A(006593), 博道中证500增强C(006594), 方正富邦中证500ETF(510550), 鹏华中证500指数C类（LOF）(006938), 方正富邦中证500ETF联接A(006656), 方正富邦中证500ETF联接C(006657), 中证500ETF工银(510530), 浙商中证500增强C(007386), 国联中证500ETF(515550), 博时中证500ETF(159968), 富安达中证500指数增强A(007943), 中证500(159982), 申万菱信中证500指数增强C(007795), 申万菱信中证500指数优选增强C(007794), 国联中证500ETF联接C(007886), 国联中证500ETF联接A(007885), 中泰中证500指数增强C(008113), 中泰中证500指数增强A(008112), 鹏华中证500ETF联接A(007932), 鹏华中证500ETF联接C(008001), 中邮中证500指数增强C(008124), 嘉实中证500指数增强A(008778), 嘉实中证500指数增强C(008779), 博时中证500ETF联接A(008396), 博时中证500ETF联接C(008397), 工银中证500ETF联接C(007223), 海富通中证500增强C(009004), 中银证券中证500ETF(515190), 华夏中证500指数增强C(007995), 中信建投中证500增强A(006440), 中银证券中证500ETF联接A(008258), 平安中证500指数增强A(009336), 兴业中证500ETF（证券简称：兴业500；扩位证券简称：兴业中证500ETF）(510570), 广发中证500指数增强A(009608), 天弘中证500ETF(159820), 西部利得中证500指数增强C(009300), 华夏中证500指数增强A(007994), 上银中证500指数增强型C(009614), 上银中证500指数增强型A(009613), 平安中证500指数增强C(009337), 中银证券中证500ETF联接C(008259), 中信建投中证500增强C(006441), 泰康500(515530), 汇安中证500增强A(010157), 中加中证500指数增强A(010153), 中加中证500指数增强C(010154), 广发中证500指数增强C(009609), 诺安中证500增强C(010355), 汇安中证500增强C(010158), 东财中证500ETF发起式联接A(010992), 兴银中证500指数增强A(010253), 东财中证500ETF发起式联接C(010993), 兴银中证500指数增强C(011205), 易方达中证500量化增强A(012080), 汇添富中证500基本面增强指数A(012498), 易方达中证500量化增强C(012081), 民生加银中证500指数增强发起式A(012926), 华夏中证500指数智选增强A(013233), 国泰中证500ETF(561350), 民生加银中证500指数增强发起式C(012927), 光大保德信中证500指数增强A(013639), 中信保诚中证500指数（LOF）C(013119), 华夏中证500指数智选增强C(013234), 富国中证500指数增强（LOF）C(013332), 光大保德信中证500指数增强C(013640), 汇添富中证500基本面增强指数C(012499), 鹏华中证500指数增强A(014344), 景顺长城中证500增强策略ETF(159610), 国泰君安中证500指数增强A(014155), 500指增(561550), 工银中证500六个月持有指数增强A(014133), 长信中证500指数C(013881), 圆信永丰中证500指数增强发起A(013878), 圆信永丰中证500指数增强发起C(013879), 南方中证500增强策略ETF(560100), 工银中证500六个月持有指数增强C(014134), 国泰君安中证500指数增强C(014156), 鹏华中证500指数增强C(014345), 华安中证500指数增强A(014587), 华泰柏瑞中证500指数增强A(014305), 中欧中证500指数增强A(015453), 泰康中证500ETF联接A(011964), 兴业中证500指数增强A(015507), 华泰柏瑞中证500指数增强C(014306), 华安中证500指数增强C(014588), 中欧中证500指数增强C(015454), 兴业中证500指数增强C(015508), 泰康中证500ETF联接C(011965), 汇添富中证500指数增强C(016854), 建信中证500指数量化增强发起A(016267), 景顺长城中证500指数增强C(016935), 建信中证500指数量化增强发起C(016268), 华泰紫金中证500指数增强发起A(016865), 易方达中证500增强策略ETF(563030), 博时中证500增强ETF(159678), 华泰紫金中证500指数增强发起C(016866), 招商中证500增强策略ETF(561950), 兴业中证500ETF发起式联接A(016968), 汇添富中证500增强策略ETF(560950), 兴业中证500ETF发起式联接C(016969), 财通中证500指数增强A(018633), 泰康中证500指数增强发起A(018116), 财通中证500指数增强C(018634), 泰康中证500指数增强发起C(018117), 富安达中证500指数增强C(019808), 中欧中证500指数增强E(019694), 中银中证500指数增强型发起A(019553), 中银中证500指数增强型发起C(019554), 中信保诚中证500指数增强A(021185), 东方红中证500指数增强发起A(021175), 大成中证500指数增强A(021170), 中信保诚中证500指数增强C(021186), 国联中证500指数增强A(021051), 东方红中证500指数增强发起C(021176), 建信中证500指数增强E(021852), 大成中证500指数增强C(021171), 中证500ETF基金(159337), 国联中证500指数增强C(021052), 天弘中证500指数增强E(022567), 苏新中证500指数增强A(022790), 西部利得中证500指数增强Y(022937), 申万菱信中证500指数优选增强Y(022919), 国投瑞银中证500指数量化增强Y(022909), 广发中证500ETF联接Y(022965), 建信中证500指数增强Y(022946), 天弘中证500ETF联接Y(022961), 华夏中证500指数增强Y(022957), 华夏中证500指数智选增强Y(022943), 富国中证500指数增强（LOF）Y(022953), 汇添富中证500指数增强Y(022893), 南方中证500ETF联接Y(022921), 华夏中证500ETF联接Y(022958), 易方达中证500ETF联接发起式Y(022913), 嘉实中证500ETF联接Y(022915), 招商资管中证500指数增强发起A(023192), 苏新中证500指数增强C(022791), 招商资管中证500指数增强发起C(023198), 永赢中证500指数增强发起A(022311), 人保中证500C(023498), 泓德中证500指数增强A(023821), 永赢中证500指数增强发起C(022312), 华商中证500指数增强A(023826), 泓德中证500指数增强C(023822), 华商中证500指数增强C(023827), 平安500ETF联接E(024556), 富国中证500ETF(159500), 天弘中证500指数量化增强(025013), 富国中证500ETF发起式联接(024179), 国泰君安中证500指数增强Y(025007), 天弘中证500指数增强Y(025043), 招商中证500增强策略ETF发起式联接(024332), 博道中证500增强Y(025038), 中金中证500指数增强B(025111), 贝莱德中证500指数增强(025418)"
A股,000906,2007-01-15,中证800,宽基,,-10.12%,-50.91%,-45.38%,1.7e+01,93.90%,1.7,66.02%,10.00%,2.48%,"天弘中证800C(001589), 天弘中证800A(001588), 长盛同庆中证800指数（LOF）(160806), 添富中证800ETF(515800), 易方达中证800ETF联接发起式C(007857), 易方达中证800ETF联接A(007856), 易方达中证800ETF(515810), 兴全中证800六个月持有指数增强A(010673), 兴全中证800六个月持有指数增强C(010674), 汇添富中证800ETF联接A(012596), 汇添富中证800ETF联接基金C(012597), 招商中证800指数增强A(016276), 招商中证800指数增强C(016277), 华夏中证800指数增强A(017985), 汇添富中证800指数增强A(017896), 华夏中证800指数增强C(017986), 汇添富中证800指数增强C(017897), 800增强ETF(159517), 鹏华中证800ETF(159800), 人保中证800指数增强A(022513), 兴全中证800六个月持有指数增强Y(022963), 人保中证800指数增强C(022514), 博道中证800指数增强A(023499), 广发中证800指数增强A(023562), 博道中证800指数增强C(023500), 鹏华中证800ETF发起式联接A(022695), 鹏华中证800ETF发起式联接C(022696), 广发中证800指数增强C(023563), 华商中证800指数增强A(024669), 中金中证800指数增强(024870), 博时中证800指数增强(023616), 华商中证800指数增强C(024670), 国联中证800指数增强(024254)"
