000928,中证能源,价值,汇添富中证能源ETF(159930)
399806,环境治理,成长,"交银中证环境治理指数(LOF)C(013413), 交银中证环境治理指数(LOF)A(164908), 汇添富中证环境治理指数A(501030), 汇添富中证环境治理指数C(501031)"
399995,基建工程,价值,"广发中证基建工程ETF联接A(005223), 广发中证基建工程ETF联接C(005224), 信诚中证基建工程指数（LOF）C(013082), 广发中证基建工程ETF(516970), 信诚中证基建工程指数（LOF）A(165525)"
000852,中证1000,宽基,"创金合信中证1000增强A(003646), 创金合信中证1000增强C(003647), 招商中证1000指数增强A(004194), 招商中证1000指数增强C(004195), 万家中证1000指数增强A(005313), 万家中证1000指数增强C(005314), 建信中证1000指数增强A(006165), 建信中证1000指数增强C(006166), 广发中证1000ETF联接A(006486), 广发中证1000ETF联接C(006487), 南方中证1000ETF发起联接A(011860), 南方中证1000ETF发起联接C(011861), 富国中证1000指数增强（LOF）C(013331), 建信中证1000指数增强发起E(013442), 华夏中证1000ETF发起式联接A(013922), 华夏中证1000ETF发起式联接C(013923), 华夏中证1000指数增强A(014125), 华夏中证1000指数增强C(014126), 天弘中证1000指数增强A(014201), 天弘中证1000指数增强C(014202), 兴银中证1000指数增强A(014831), 兴银中证1000指数增强C(014832), 华安中证1000指数增强A(015148), 太平中证1000指数增强A(015466), 景顺长城中证1000指数增强A(015495), 中信建投中证1000指数增强A(015784), 国泰君安中证1000指数增强A(015867), 易方达中证1000ETF联接A(016630), 富国中证1000ETF联接A(016633), 嘉实中证1000指数增强发起式A(016776), 鹏华中证1000指数增强A(016785), 国联安中证1000指数增强A(016962), 申万菱信中证1000指数增强A(017067), 鑫元中证1000指数增强发起式A(017190), 华宝中证1000指数(162413), 南方中证1000ETF(512100), 中证1000(516300), 广发中证1000ETF(560010), 汇添富中证1000ETF(560110), 1000增强(561590), 富国中证1000ETF(159629), 易方达中证1000ETF(159633), 1000增强ETF(159677), 国泰中证1000增强策略ETF(159679), 招商中证1000增强策略ETF(159680), 华夏中证1000ETF(159845), 富国中证1000指数增强（LOF）A(161039)"
930901,动漫游戏,成长,"国泰中证动漫游戏ETF联接A(012728), 国泰中证动漫游戏ETF联接C(012729), 华夏中证动漫游戏ETF发起式联接A(012768), 华夏中证动漫游戏ETF发起式联接C(012769), 国泰中证动漫游戏ETF(516010), 游戏动漫ETF(516770), 华夏中证动漫游戏ETF(159869)"
399807,高铁产业,价值,"南方中证高铁产业指数（LOF）(160135), 鹏华中证高铁产业指数(LOF)A(160639)"
399967,中证军工,成长,"前海开源中证军工指数A(000596), 前海开源中证军工指数C(002199), 广发中证军工ETF联接A(003017), 广发中证军工ETF联接C(005693), 易方达中证军工指数（LOF）C(012842), 富国中证军工指数C(013035), 易方达中证军工指数（LOF）A(502003), 易方达中证军工ETF(512560), 国泰中证军工ETF(512660), 广发中证军工ETF(512680), 华宝中证军工ETF(512810), 富国中证军工指数A(161024), 申万菱信中证军工指数A(163115)"
930781,中证影视,成长,"国泰中证影视主题ETF(516620), 影视ETF(159855)"
930794,中美互联网,成长,"天弘中证中美互联网A(009225), 天弘中证中美互联网C(009226)"
399804,中证体育,成长,"富国中证体育产业指数C(013278), 富国中证体育产业指数A(161030)"
399971,中证传媒,成长,"广发中证传媒ETF联接A(004752), 广发中证传媒ETF联接C(004753), 工银传媒指数C(010677), 工银传媒指数A(164818), 广发中证传媒ETF(512980), 传媒ETF(159805), 鹏华中证传媒指数(LOF)A(160629)"